,Keyword,公司名称,公司规模,地区,学历要求,工作经验,职位名称,职位描述,职位薪资,融资情况
455,数据挖掘,大设科技,20-99人,上海 长宁区 曹家渡,硕士,1-3年,数据挖掘,职位信息1.参与构建信息系统的数据挖掘和算法建设2.理解相关业务需求3.设计有效评估指标，并设计实现算法优化4.参与业务应用中的设计和讨论岗位要求：1.重点大学计算机、统计、数学等相关专业，硕士以上学历，2年以上工作经验2.算法基础扎实，熟悉数据挖掘、机器学习常见算法3.有linux下的开发和工作经验，精通Python、R、MATLAB、SAS等任意一中或者多种数据编程语言4.有分布式计算开发经验、熟悉hive，hadoop，spark者优先5.有精准广告、推荐系统、精确营销等领域工作经验者尤佳6.对数据挖掘事业极其热爱，工作积极投入,12k-24k,天使轮
456,数据挖掘,深兰科技,500-999人,上海 长宁区 新华路,硕士,经验不限,LBS数据挖掘工程师,岗位职责1、处理用户轨迹信息，建立LBS基础数据库，挖据发现交通相关地理信息；2、使用用户轨迹信息，建立用户行为模型，对用户出行偏好进行画像；3、基于轨迹信息、出行信息进行搜索与推荐算法研究和实现；任职条件1、硕士及以上学历，三年以上机器学习、数据挖掘工作经验，熟悉地图数据空间关系处理和地理要素；2、具有统计或数据挖掘背景，并对机器学习算法和理论有较深入的研究； 3、熟悉数据挖掘相关算法(决策树、SVM、聚类、逻辑回归、贝叶斯)，并具备1年以上的实际工作经验；4、熟悉Hadoop等分布式平台，熟练掌握java/python语言，有Spark/HBase经验者优先；5、有地产、零售、大规模数据挖掘经验者优先或交通信息挖掘经验者优先；,15k-30k,B轮
457,数据挖掘,智信融科,0-20人,上海 杨浦区 大柏树,本科,经验不限,数据挖掘,量化交易培训生2-3人[岗位职责]协助开发人员进行量化交易和研究系统的开发，协助投资经理进行投资策略的开发[岗位要求]1. 数学或统计、计算机、电子信息、物理等理工科相关背景的本科生/硕士/博士生，要求985及211以上2. 熟练使用以下至少一门语言：python/perl/matlab/R/C，并且具备在linux环境下工作的能力3. 具备扎实的数理基础，熟悉基本的统计分析方法4. 工作积极、责任心强、具备良好的沟通能力和团队合作能力 [工作地点]上海市杨浦区五角场附近[公司描述]创始人毕业于清华大学等院校，己从事对冲基金行业及参与交易多年，专注研究中国市场的量化投资模型并己取得极佳的投资业绩。我们志于建立一支优秀的量化交易团队，我们将提供极有竞争力的薪酬体系和愉悦平和的工作氛围，希望能成为中国市场上领先的专业化量化投资服务的提供者。当前的金融市场潜力无限，机遇无限，我们诚邀有能力有抱负的年轻人一起共创未来欢迎有兴趣动手能力强的同学投递简历至*****,20k-40k,不需要融资
459,数据挖掘,荟医信息,20-99人,上海 静安区 火车站,博士,1年以内,数据挖掘,数据挖掘工程师岗位职责：1、海量医疗数据的清洗、统计、挖掘等算法研发;2、利用机器学习模型在医学研究等方面对各种影响因素的挖掘与探索;3、参与机器学习、数据挖掘、统计分析类的算法研究与实现。岗位要求：1、计算机、数学、统计等本科或以上学历2、熟练掌握机器学习算法（对优化理论和算法有研究、实践）；熟练运用SQL、R、Python等工具；3、突出的分析问题和解决问题能力，自我驱动，并且具备较强的学习能力、创新应用能力及沟通协调能力；4、拥有分布式图计算，实时流计算（spark/storm），大数据处理（Hadoop/Hbase/Hive）经验者优先，有深度学习研究经验者优先。,20k-40k,未融资
461,数据挖掘,平安科技,1000-9999人,上海 浦东新区 梅园,硕士,3-5年,资深数据挖掘工程师,"【平安科技企业介绍】平安科技是平安集团（2017年世界500强排名第39位）旗下的全资子公司，是平安集团高科技核心和创新孵化器，也是“2017 IDC Fintech全球百强榜单”中唯一排名Top50的中国企业。【我们的优势】优秀的团队配置部门由国家“千人计划”专家肖京博士领衔，拥有深圳“孔雀计划”专家以及来自牛津、哈佛、卡内基梅隆等顶尖学府博士及技术精英。三个方向布局部门专注于AI智慧金融/智慧医疗/智慧城市三个方向布局，项目受到业界媒体的高度关注。比肩BAT的技术实力发布全球首个大数据+人工智能流感预测模型，99.84%人脸识别精度，99%+声纹识别精度，400+AI技术专利。海量的优质数据拥有平安集团多年沉淀的金融/医疗数据，亿级数量，上万维度字段。一对一导师制度不管是实习生还是正式员工皆有大牛导师引导，带你快速实现自我成长和价值实现。丰厚的福利待遇丰富的下午茶、不定期团建聚餐、优厚的节日福利……只要你够优秀，薪酬待遇绝对有竞争力。三大职场自由选择深圳、上海、北京三个职场根据个人情况选择，办公环境整洁舒适。 【招聘岗位介绍】岗位：人工智能与大数据资深数据挖掘工程师（工程实施方向）工作内容：主攻智慧金融/智慧医疗/智慧城市方向，参与集团核心项目工作，负责人工智能应用解决方案的实施负责研究提升算法模型的精度和效率参与研发自然语言理解相关算法，负责完成辅助诊断、智能预测等医疗/金融AI解决方案涉及实施基于业务，挖掘数据价值，通过数据分析手段发现和分析业务问题，产生洞察，为预测作支持任职要求：扎实的算法基础：熟悉机器学习基本理论和算法相关原理，具备扎实良好的数学基础能够从复杂的医疗/金融业务场景中进行算法选型、算法优化不断提升效果，并能够真正应用在商业环境精通Python、Scala、HiveSql，具备优秀的开发和调试能力逻辑清晰，善于思考和总结，能够快速响应，积极主动完成任务熟悉Linux环境，有基于TensorFlow/Caffe 等研发深度学习算法经验者优先熟悉Spark、Hadoop框架，开源社区活跃者优先有医疗/金融AI相关从业经验优先（有实际项目落地经验者更佳，包括但不限于将AI技术实际运用到营销、获客、风控、催收等场景中）三年以上工作经验工作地点：深圳、上海、北京岗位：资深数据挖掘工程师（金融应用方向）工作内容： 1. 负责配合约见客户，引导客户的思考方向，做好业务、技术层面的支持； 2. 负责调研客户前期需求并撰写需求说明书及各类售前文案、投标文件，同时协调实施工程师与相关方做好后期的需求确认工作； 3. 回复和响应客户的业务或技术需求，与客户进行业务交流、技术交流，关注市场竞争信息，进行市场信息的收集和分析； 4. 分析研究国内外业务相关的大数据技术发展趋势及金融数据应用和技术方案发展趋势； 任职要求： 1.	计算机或金融、医疗相关专业。2.	有互联网、互联网金融、保险、银行、证券等行业大数据相关技术及数据分析项目实施工作经验，3年以上数据领域售前需求分析和技术解决方案咨询工作经验。 3.	熟悉互联网、云计算或大数据相关产品和技术，有大数据机器学习技术基础（机器学习算法、Hadoop、Spark等开源技术平台和体系）。4.	熟悉行业常见金融大数据应用平台，特别是风控平台，了解其优缺点及适用场景。 5.	熟悉金融（保险、证券、银行等）核心相关业务及应用系统架构者优先。 6.	较强的沟通协调能力、文档表达能力、学习能力以及主动性，能够承受较大工作压力。工作地点：深圳、上海、北京岗位：资深数据挖掘工程师（医疗应用方向）工作内容：主要完成针对各种行业客户如智慧城市（医疗）、政府、医院等的大数据项目需求分析工作，具体职责如下：1、负责行业项目的客户交流、市场调研及技术需求分析支持，牵头组织智慧医疗行业大数据项目实施，帮助客户清晰的规划实施路线，及提供针对性的可落地的建议方案，包括现状评估、实施方案设计、规范文档等；2、负责行业应用及技术知识模块提炼及售前技术支撑工作（设定范围、提出解决方案、客户交流）；跟踪收集和分析行业动态、客户市场动态数据；3、负责调研行业用户需求，将行业内的业务需求转化为数据及模型需求； 4、与销售、研发、产品保持良好的沟通，协同工作，协同团队达成短中长期目标；5、对行业、市场、用户需求等方面定期提出分析报告，为团队市场方向、市场合作、产品研发等提供需求建议。任职要求：1、计算机或医疗、社会学、人口学相关专业。2、具备智慧城市、政府、医疗、金融等行业背景，有大型项目IT整体规划、售前需求分析咨询经验；3、熟悉云计算和大数据相关产品和技术，有大数据技术及理论基础；4、能独立编写优质的大数据售前需求分析技术方案，制作方案演示稿；工作地点：深圳、上海、北京岗位：资深数据挖掘工程师（可视化方向）工作内容： 1、和大数据工程师、数据科学家共同工作,探索可视化在金融、医疗业务场景的技术方案和产品应用； 2、设计实施展示为主的数据大屏和业务分析为主的数据可视化; 3、负责大数据项目结果可视化的前端展示设计及实施 4、负责数据可视化项目设计实施工作；设计数据可视化相关的技术方案； 5、深入理解主要数据可视化展现形式，针对实际场景梳理数据信息，提出专业的数据可视化元素使用意见。 6、负责根据业务需求快速理解实际痛点，利用合适的数据分析及可视化方法展现商业逻辑和成因，高效输出可视化方案。任职要求：1、本科及以上学历，3年以上实际工作经验，功底扎实，视野开阔； 2、工程能力强，熟悉Axure RP等设计工具,有较复杂的 WebApp 类型产品前端开发经验； 3、精通数据可视化开源方案，有数据分析场景/数据可视化经验者(ECharts/Highcharts/D3)优先； 4、技术跟随前沿,熟悉Servlet,HTML5,JavaScript,Json,了解Node/AngularJS/React； 5、熟悉Web后台性能优化和前端展示技术; 6、熟悉1-2种分析型数据库(如Hive/Neo4j)者优先；7、学习能力和团队意识强，拥有优秀的数据驱动思维及逻辑思维。 8、善于运用页面布局、色彩等设计知识。 熟练使用可视化BI工具及前端工具，包括但不限于Tableau、PowerBI，QV，Echarts、D3等。 9、熟悉一种脚本语言，包括但不限于Python、R、SQL等。 10、善于思考，沟通能力强。 在某项领域（金融、零售、互联网、制造业等）拥有多年数据分析可视化经验",20k-40k,不需要融资
462,数据挖掘,上海聚泛信息科技,100-499人,上海 徐汇区 龙华,本科,3-5年,数据挖掘,岗位职责：1.基于业务需求，持续进行数据模型和算法的分析优化；2.独立负责业务数据收集整理，搭建业务数据体系，结合业务对多种数据源进行深度诊断性组合分析、挖掘、深度分析。3.深入挖掘和分析海量互联网用户数据，挖掘用户行为特征，建立预测性模型；4.在业务出现指标异常状况时进行针对性的数据分析，迅速锁定问题源头并提出解决方案。岗位要求：1.本科及以上学历，数学类、统计类、计算机类专业优先；2.熟悉lr，决策树，随机森林，boosting等主流算法；3.熟练使用python，SQL，对数据科学有一定兴趣；4.有金融数据分析经验加分，名校加分，对分布式机器学习有了解加分,20k-30k,A轮
463,数据挖掘,DataVisor,100-499人,上海 浦东新区 周浦,硕士,3-5年,数据挖掘,职位描述：算法 / AI团队拥有DataVisor的秘密武器。我们在数亿用户产生的数千亿的事件中运行我们先进的无监督分析引擎及各种机器学习模型。我们是大数据软件工程师与数据科学家的结合体。我们擅长在数据中寻找优美的模型，来捕捉和防止恶意用户对正常用户恶意攻击。我们乐于提出新的想法并将其付诸实践，以改进我们的检测引擎。如果您有处理大数据的丰富经验，期待成为引领新技术前沿中的一员，并希望在直接影响公司利润的团队中工作，我们期待与您的进一步交流。    职位要求: 1.     4年以上Java或C / C ++ / C＃使用经验2.     2年以上Web后端或Hadoop/ MapReduce/Spark使用经验3.     2年以上机器学习或人工智能相关工作经验的优先考虑4.     硕士以上学历，拥有博士学位者优先考虑5.     熟练的英文读写能力我们提供的待遇:    1.     极具竞争力的薪水、奖金和股票期权2.     直接深度参与DataVisor的技术研发工作 3.     直接和硅谷的团队对接学习第一手的硅谷大数据领先技术和工程经验4.     其他福利（五险一金，补充医疗保险，免费午餐，团建活动等等）,22k-40k,C轮
464,数据挖掘,遨游酒店信息技术公司,1000-9999人,上海 徐汇区 淮海路,本科,3-5年,数据挖掘,nlp，图像处理，推荐，风控，定价，知识图谱任选其一即可。,20k-40k,D轮及以上
465,数据挖掘,腾讯,10000人以上,上海 徐汇区 漕宝路,硕士,3-5年,广告数据挖掘与算法工程师（上海）,岗位职责：	参与展示广告售卖与投放的算法研发； 参与视频广告库存预估、在线投放等算法的研发；参与点击率预估的算法研发；参与Look-alike人群扩散相关的算法研发。岗位要求：	计算机本科及以上学历，3年以上相关工作经验；扎实的数据结构和算法基础，精通C/C++、Java、Python等至少一门开发语言；熟悉linux下的开发环境，极佳的算法与工程实现能力；有数据挖掘、机器学习、深度学习等相关经验者优先；有互联网广告行业开发经验者优先；有进取心，责任心强， 能够主动快速学习新的算法与工程技术。,30k-60k,已上市
466,数据挖掘,浙江新再灵,100-499人,上海 杨浦区 复旦大学,硕士,1-3年,数据挖掘工程师,岗位职责1. 采集、抓取、清洗外部数据，满足业务需求。2. 推动业务过程中数据管道的建立，并实施维护。3. 推动商业数据仓库的建立，并实施维护。4. 通过分析挖掘产出有效的数据模型、客户行为、习惯等分析报告。5. 和算法部门协作，提供数据支持，并推动核心算法的落地。6. 和业务部门密切配合寻求数据层面的商业价值。任职条件两年以上工作经验，硕士及以上学历，计算机、电子通信、数学等相关专业。1. 具备查阅研读相关中英文论文的能力；2. 扎实的统计学、数据挖掘、机器学习理论基础，能够利用高等数学知识推演高维数学模型；3. 熟悉聚类、分类、回归、图模型等机器学习算法，对常见的核心算法理解透彻，有实际建模经验；4. 具有扎实的计算机操作系统、数据结构等编程基础，熟练掌握至少一门编程语言例如c++/python/R；5. 能熟练使用Hadoop、Hbase、Hive等有实践经验者优先；6. 对于推荐系统和广告系统有实践经验者优先；7. 熟练使用python爬虫技术者优先。,15k-25k,D轮及以上
467,数据挖掘,世强信息,20-99人,上海 普陀区 江宁路,本科,1-3年,算法工程师/数据挖掘工程师,算法工程师岗位职责：1、负责各类算法和模型的开发、验证和实施（离线、在线），独立完成项目模块级功能开发，实现算法平台的功能落地。2、应用数据挖掘、机器学习、自然语言处理等技术，结合实际场景对海量信息建模，并提供全面的技术解决方案。3、参与机器学习、深度学习等领域的技术研发和前沿探索。岗位要求：1、计算机、数学、统计等专业，本科及以上学历，1-2年工作经验2、能熟练使用Scala/Java/Python等语言，熟悉Linux开发；有较强面向对象编程基础。3、掌握基本数据挖掘方法，聚类分析、分类、回归、协同过滤、关联分析、推荐等基础算法的原理和工具，熟悉一个或多个主流深度学习框架，如Tensorflow、Caffe、Keras等，并有实际建模经验，有自然语言处理经验者优先。4、了解批量离线式分布式并行计算技术，如Hadoop、Hive、Spark、Storm等及其生态圈5、熟悉SQLServer或MySQL数据库的基础SQL脚本6、有较强逻辑思考能力和问题分析能力，思维缜密7、有良好的团队合作意识，较强的沟通能力，敢于挑战新技术。认真负责，善于分析问题的本质，有积极钻研的态度，学习新知识的激情，有一定的抗压能力；,15k-28k,不需要融资
468,数据挖掘,晶赞科技,100-499人,上海 静安区 共和新路,硕士,3-5年,高级数据挖掘工程师,1、负责设计、开发挖掘类算法模块。2、建立数据挖掘模型，分析数据，识别潜在问题及其商业价值，设计方案，构建原型。3、数据处理、检查与清洗等，项目数据建模、模型的选取与优化、模型验证等工作；4、对运营数据进行分析与监控，基于数据进行用户画像描绘、用户分层，深度挖掘用户行为特征，构建用户的指标体系；任职资格： 1、 硕士或博士学位，专业为计算机、应用数学、模式识别、自动控制、统计学、运筹学等； 3年以上相关工作经验；2、 有统计建模、机器学习（聚类、分类、回归等）或数据挖掘应用于大数据的项目经验，或在某个相关技术方向有深入研究；3、 熟练掌握Java，Scala，SQL编程能力其中一种；4、 以下为加分项：    a) 有推荐系统、深度学习框架等方面的建模经验；    b) 有大规模分布式计算平台（Hadoop）的使用和并行算法开发及应用经验；    c) 优秀的沟通表达能力。,20k-35k,D轮及以上
469,数据挖掘,橙鹰,100-499人,上海 闵行区 华漕,本科,1-3年,数据挖掘,工作内容：1.  根据业务、项目、客户的实际情况，提炼业务需求，梳理底层数据，完成数据的融合、清洗、分析、建模等工作，高效地解决实际问题；2.  社会治理领域的大数据探索和创新，包括数据集成、挖掘算法、产品设计和可视化展现等方向，不断提升该领域的大数据应用能力。 职位要求：1.  硕士+1年以上相关工作经验（或本科+3年以上相关工作经验），统计、数学、计算机等相关专业；2.  熟练掌握SQL，熟悉常用数据库，掌握数据挖掘相关的编程语言，有Hadoop生态或ODPS生态的使用经验优先；4.  (加分项)熟悉互联网安全或公共安全业务，能够设计创新而实际的分析建模方法以解决复杂的业务问题；5.  心态积极向上，乐于面对挑战。,17k-34k,不需要融资
470,数据挖掘,触宝,100-499人,上海 徐汇区 虹梅路,本科,3-5年,高级数据挖掘工程师,职位描述：1、通过对数据的敏锐洞察以及定性和定量分析，迅速定位内部问题或发现机会； 2、负责商业化日常数据分析及监控，针对异常情况协调资源进行跟踪和深入分析； 3、能根据实际业务完成较深入的专项数据分析，并形成数据分析报告； 4、负责数据分析体系建设和完善，挖掘流量、产品、策略方面的商业变现机会，驱动商业化业务发展。职位要求：1、本科以上学历，统计、计算机相关专业；2、具备3年以上数据分析经验，熟练掌握SQL，熟悉常用数据统计和分析方法，至少熟练使用R、SAS、MATLAB、PYTHON中的一种； 3、良好的逻辑思维能力、业务解读能力和快速学习能力，能够独立领导完整的数据分析项目； 4、对数字比较敏感，热爱数据分析工作。,20k-40k,D轮及以上
471,数据挖掘,七炅信息,20-99人,上海 浦东新区 八佰伴,硕士,1-3年,数据挖掘工程师,岗位职责 ·       分析和挖掘机器学习算法在金融行业的实际应用，包括使用结构性和非结构性数据。·       针对客户提供的海量数据和不同的商业应用目标，钻研前沿技术，并对算法进行评估、筛选开发和实现。·       指导业务团队和IT开发团队对相应算法进行商业和软件应用。任职要求·       985/211院校毕业，统计，数学或者计算机专业学位。研究生以上学历，工作经验不少于两年；博士学历，工作经验不少于1年。·       数理功底扎实，熟悉各种机器学习算法，并能灵活使用，帮助各类业务场景提升效率。精通各类机器学习算法，能够快速阅读英文前沿科技资料。强好奇心，善于自主学习和解决问题，对技术热忱并愿意不断通过研究学习提升自己。·       熟悉基于python的数据挖掘工具，包括numpy，scipy，sklearn等，并有良好的编程习惯和代码风格。·       有商业应用常识，熟悉常见的项目管理方式，沟通能力强，善于团队协作,18k-36k,A轮
473,数据挖掘,博世猫,100-499人,上海 徐汇区 漕河泾,本科,1-3年,数据挖掘高级工程师,岗位描述：1、基于每日百亿级展现数据，搭建大数据处理平台;实现流式事件的实时计算，落地储存。对于离线数据完成数据仓库的建立，为数据挖掘提供有效的数据； 2、使用用户行为数据，广告投放数据，挖掘数据层次关系，分析媒体.流量.广告主等数据来提高变现效率；3、数据分析，挖掘，模型具体的产品化；了解广告业务，能和PM合作，基于数据驱动持续优化数据产品。4、业务分析、技术把关与人才选拔岗位要求：1、熟悉C++、JAVA、python中的一种或多种编程技术，编程能力强，熟悉大数据处理技术，善于学习应用业界领先数据架构和技术；2、对大数据开源组件有使用经验，对hadoop/hive/spark/ES/druid 其中一项精通；3、熟悉数据挖掘算法，包括数据清洗.统计学习.分类聚类算法，并能够验证算法效果，将算法应用在广告业务中； 4、善于学习，思维活跃，善于从数据中发现.思考并解决问题；5、有广告研发经验者优先，对广告行业有自己思考的优先。,25k-50k,B轮
474,数据挖掘,快牛金科,1000-9999人,上海 长宁区 北新泾,硕士,3-5年,数据挖掘,职责描述：•	负责海量数据处理、建模、分析报告•	通过研究贷款客户的基本信息、征信信息、行为日志等数据，实现贷款客户的反欺诈建模工作•	利用机器学习解决金融科技相关场景的问题，包括但不限于流量获客，风险控制，客户关系维系等•	设计风控数据收集、整合需求，搭建风控数据模型数据管理仓库和数据集市，探索自动化风控平台的实现任职要求：•	硕士及以上学历，三年及以上互联网行业数据挖掘相关工作经验，有评分卡建模经验者优先•	精通机器学习基本原理和实际应用，对常见算法-GBDT、XGBoost、RandomForest、逻辑回归等有很好的理解•	熟悉数据库和数据分析工具，熟练运用SQL、Python、R、SAS等进行高效数据处理、挖掘和分析•	有大数据平台Hadoop、Spark项目经验者优先•	具备良好的逻辑分析能力，善于沟通和表达，能承受快节奏工作压力，愿意不断学习新的知识,20k-30k,B轮
475,数据挖掘,爱回收,1000-9999人,上海 杨浦区 五角场,本科,10年以上,数据挖掘师,职位描述1.参与部门业务数据体系的规划，负责海量运营数据的分类汇总和分析研究； 2.针对专项分析任务，设计分析逻辑，推进并完成分析报告，提供决策支持； 3.关注产品转化、用户运营、渠道推广、活动运营等常态数据指标，设计并输出例行的报告，从而跟踪产品数据发展趋势，监控数据变化； 4.跨部门项目的牵头及推进，数据对接、流程对接等； 5.组织内部、外部的培训及知识共享，提升团队的专业水平； 6.随时跟进竞争对手的表现，分析评估行业、竞争对手等相关信息并提出相应的跟进措施；任职要求1.有海量数据分析处理经验; 2.大学本科及以上学历，5年以上数据分析、产品运营等相关互联网工作经验优先； 2.出色的分析和解决问题的能力，具备优秀的的数据敏感性和逻辑思维能力； 3.过往有内容行业的产品数据分析经验，并有通过数据分析项目大幅提升运营指标的案例优先； 4.良好的数据库相关技术背景，熟悉至少一种主流数据库（MySQL、Oracle、DB2、SQLServer），熟悉主流数据商业智能工具； 5.良好的沟通能力和团队合作能力，有团队和项目管理经验，有强烈的工作责任心。,21k-39k,D轮及以上
